{
  "schema_version": "sensekit.event.v1",
  "device_id": "iphone_julian",
  "event": {
    "schema_version": "sensekit.context_event.v1",
    "event_id": "evt_01",
    "event_type": "driving_started",
    "occurred_at": "2026-03-09T07:44:11Z",
    "confidence": 0.7,
    "reasons": [
      "motion.automotive_entered",
      "motion.automotive_sustained_180s"
    ],
    "mode_hint": "voice_safe",
    "cooldown_sec": 900,
    "dedupe_key": "iphone_julian:driving_started:2026-03-09T07:44"
  },
  "snapshot": {
    "schema_version": "sensekit.context_snapshot.v1",
    "captured_at": "2026-03-09T07:44:11Z",
    "routine": {
      "awake": true,
      "focus": null,
      "workout": "inactive"
    },
    "place": {
      "type": "other",
      "freshness": "recent"
    },
    "calendar": {
      "in_meeting": false,
      "next_meeting_in_min": 38,
      "freshness": "live"
    },
    "device": {
      "battery_percent_bucket": 80,
      "charging": false
    },
    "health": {
      "captured_at": "2026-03-09T07:44:11Z",
      "sleep": {
        "available": false,
        "authorized": false,
        "freshness": "stale",
        "last_sleep_start_at": null,
        "last_sleep_end_at": null,
        "asleep_minutes": null,
        "in_bed_minutes": null,
        "seven_day_avg_asleep_minutes": null,
        "delta_vs_seven_day_avg_minutes": null
      },
      "workout": {
        "available": false,
        "authorized": false,
        "freshness": "stale",
        "active": false,
        "today_count": null,
        "today_total_minutes": null,
        "today_active_energy_kcal": null,
        "last_type": null,
        "last_start_at": null,
        "last_end_at": null
      },
      "nutrition": {
        "available": false,
        "authorized": false,
        "freshness": "stale",
        "last_logged_at": null,
        "protein_g": null,
        "protein_target_g": null,
        "protein_remaining_g": null,
        "calories_kcal": null,
        "calories_target_kcal": null,
        "calories_remaining_kcal": null,
        "water_ml": null,
        "water_target_ml": null,
        "water_remaining_ml": null
      },
      "activity": {
        "available": false,
        "authorized": false,
        "freshness": "stale",
        "steps": null,
        "active_energy_kcal": null,
        "distance_km": null,
        "seven_day_avg_steps_by_now": null,
        "delta_vs_seven_day_avg_steps_by_now": null
      },
      "recovery": {
        "available": false,
        "authorized": false,
        "freshness": "stale",
        "resting_heart_rate_bpm": null,
        "resting_heart_rate_delta_vs_14_day_avg_bpm": null,
        "hrv_sdnn_ms": null,
        "hrv_delta_vs_14_day_avg_ms": null,
        "measured_at": null
      },
      "mind": {
        "available": false,
        "authorized": false,
        "freshness": "stale",
        "latest_state": null,
        "logged_at": null
      }
    }
  },
  "policy": {
    "schema_version": "sensekit.policy_decision.v1",
    "event_type": "driving_started",
    "allowed_actions": [
      "send_voice_note",
      "send_tts",
      "send_short_text"
    ],
    "blocked_actions": [
      "send_long_markdown"
    ],
    "delivery_channel_preference": [
      "voice_note",
      "tts",
      "short_text"
    ],
    "ttl_sec": 1800
  },
  "delivery": {
    "attempt": 1,
    "queued_at": "2026-03-09T07:44:12Z"
  }
}
